{
  "editorial_version": "jd-match-editorial/0.1.0",
  "voice_version": "jd-match-voice/0.2.0",
  "case_id": "sup-market-freshgrad",
  "job_id": "job-s1",
  "case_tag": "CASE #S1",
  "masthead": {
    "title": "岗位匹配深度诊断与改写",
    "case_label": "Case #S1（应届生 · 市场专员）"
  },
  "verdict": {
    "heading": [
      {
        "t": "先补一块再投：活动执行是强项，投放是空白。",
        "style": "marker"
      }
    ],
    "prose": "你手里有两段能直接对上活动的证据：**社群抽奖（参与率约 25%）和校园活动（300+ 人参与）**。卡住的是「熟悉主流线上投放渠道（信息流/搜索/社媒）」——简历里一个字都没有。这是信息空白，不是能力否定；先把这块补上（实操记录或课程项目都行），再投不迟。"
  },
  "comparison": [
    {
      "job_id": "job-s1",
      "badge": "主目标建议",
      "badge_type": "primary",
      "title": "市场专员",
      "note": "单岗位：活动策划执行有实据，投放渠道完全空白；补上这块证据，覆盖面会明显改观。"
    }
  ],
  "findings": [
    {
      "title": "两段活动经历都带数字，但都缩在各自条目的后半句",
      "body": "市场岗最想看的是执行力度：参与率、参与人数。你有——25% 的抽奖参与率、300+ 人的校园活动，一个住在括号里，一个躺在句尾。",
      "pin_accent": true,
      "strip_label": "活动实绩在句尾",
      "strip_body": "25% 参与率与 300+ 人参与，都压在条目后半句",
      "evidence_ids": [
        "ev-a2",
        "ev-a4"
      ],
      "loupe": {
        "source_label": "实习经历 · 第 2 项",
        "raw_line": "运营用户社群 2 个（共约 400 人），策划社群抽奖活动 1 场，参与率约 25%",
        "highlight": "参与率约 25%",
        "highlight_label": "埋没痛点",
        "annotation": "25% 参与率是市场岗最认的执行力度数字，别让它躺在句尾从句里。提到动词旁边，它就是「策划并执行过活动」的落点。",
        "evidence_ids": [
          "ev-a2"
        ]
      }
    },
    {
      "title": "「熟悉主流线上投放渠道（信息流/搜索/社媒）」整条空白：不是不会，是简历里完全没写",
      "body": "投放是这份岗位的明确要求。简历无任何记录时只能记「看不出来」——它拉低的是证据覆盖，补一段实操或课程项目就能改写这条判定。",
      "strip_label": "投放完全空白",
      "strip_body": "信息流/搜索/社媒，简历一字未提",
      "evidence_ids": []
    },
    {
      "title": "「有校园渠道或 KOC 资源者优先」只差半步：组织过活动 ≠ 有渠道",
      "body": "你有校园活动的组织经验，但「渠道资源」指的是可复用的触达关系。相关但不对等，记一半——真有渠道关系（社团合作、KOC 联系方式）就写进去。",
      "strip_label": "资源差半步",
      "strip_body": "组织过校园活动，但没有可复用的渠道关系记录",
      "evidence_ids": [
        "ev-a4"
      ]
    }
  ],
  "rewrites": [
    {
      "rewrite_id": "rw-s1",
      "label": "校园活动条目",
      "jd_anchor_req": "req-s1-m1",
      "jd_anchor": "策划面向年轻用户群体的线上活动，负责执行与复盘",
      "badge": "链路重排",
      "badge_tone": "neutral",
      "after_label": "改后定稿（做了什么 → 结果如何）",
      "strikes": [
        "与现场签到组织"
      ],
      "highlights": [
        "300+ 人"
      ],
      "annotation": "市场岗看活动的完整链路：策划、执行、结果。原句把宣传、签到、参与人数平铺直叙；改写按**做了什么 → 结果如何**收拢，让「300+ 人参与」成为这条经历的落点。**「复盘」那半边救不了**——简历里没写过复盘，行动清单里补三行就够。"
    }
  ],
  "pending_fill_note": "投放渠道没有任何材料证据，改写不凑数——补一段真实的投放实操（哪怕个人账号小额投流），或至少补一份渠道分析作业；确无就明说放弃，这项空白保留。",
  "actions": [
    {
      "action_id": "act-s1-1",
      "badge": "第 1 步 · 补证据",
      "badge_tone": "red",
      "timing_tag": "填最大的空白",
      "title": "补一段投放证据：实操记录或课程项目",
      "body": "「熟悉主流线上投放渠道」是这份岗位的明确要求。做过就补记录，没做过就先补一个课程项目——空白比不完美更伤覆盖分。",
      "deliverable_label": "交付成果",
      "deliverable": "个人投放实践记录或课程项目链接",
      "criteria_label": "完成标准",
      "criteria": "新增一条可引用证据；确无则在重跑时保留「看不出来」，不虚写"
    },
    {
      "action_id": "act-s1-2",
      "badge": "第 2 步 · 投递前校验",
      "timing_tag": "数字核对",
      "title": "把改写落进简历后投递",
      "body": "一处改写，数字核对后即可投。",
      "deliverable_label": "交付成果",
      "deliverable": "新版简历投出",
      "criteria_label": "完成标准",
      "criteria": "改写已应用；数字与原文一致；没有新增事实"
    },
    {
      "action_id": "act-s1-3",
      "badge": "第 3 步 · 补半边职责",
      "timing_tag": "复盘三行就够",
      "title": "给社群抽奖活动补三行复盘",
      "body": "岗位要「负责执行与复盘」——复盘那半边你还没写。目标、动作、结果三行就够，数字用原文的。",
      "deliverable_label": "交付成果",
      "deliverable": "可引用的活动复盘段落",
      "template": "「活动目标（拉新/促活）：…；关键动作：…；结果：参与率约 25%，社群 2 个共约 400 人」",
      "template_label": "三行复盘模板",
      "template_tone": "green",
      "criteria_label": "完成标准",
      "criteria": "复盘含参与率约 25% 等原文数字，无新增事实"
    }
  ],
  "evidence_notes": [
    {
      "req_id": "req-s1-m1",
      "focus": true,
      "note": "策划与执行两边都有实据（社群抽奖参与率约 25%、校园活动 300+ 人参与）；「复盘」没写。整体仍记「有实据」，复盘缺口单列——三行复盘就能补上。"
    },
    {
      "req_id": "req-s1-m2",
      "focus": true,
      "note": "投放渠道简历无任何记录——应届生有没有了解，材料里看不出，记「看不出来」（看不出来不等于不具备）。补实操或课程项目即可改写这条判定。"
    },
    {
      "req_id": "req-s1-m3",
      "note": "独立撰写文案有频次与效果：实习 12 篇推文 + 校园 3 篇宣传推文，记「有实据」。"
    },
    {
      "req_id": "req-s1-m4",
      "note": "组织过校园活动与「校园渠道资源」相关，但渠道指的是可复用关系，不等同，记「部分满足」。"
    }
  ],
  "gate_notes": [
    {
      "gate_id": "gate-s1-g1",
      "note": "岗位要「本科及以上学历」，你在读本科、2026 届，毕业入职时点满足，有教育背景原文为证，核实通过。"
    }
  ],
  "cards": {
    "cover": {
      "kicker": "市场专员 · 应届生案例自查",
      "headline": [
        {
          "t": "活动经历带数字，"
        },
        {
          "br": true
        },
        {
          "t": "投放整条",
          "style": "red"
        },
        {
          "t": "空白。"
        }
      ],
      "page_label": "封面诊断",
      "banner_sub": "空白不是能力否定——补一段实操，覆盖面立刻改观"
    },
    "findings_card": {
      "kicker": "发现透视 · 逐条对照",
      "headline": [
        {
          "t": "强项躲在句尾，"
        },
        {
          "br": true
        },
        {
          "t": "空白挡在",
          "style": "red"
        },
        {
          "t": "门口。"
        }
      ],
      "page_label": "发现透视"
    },
    "actions_card": {
      "kicker": "先做便宜的 · 执行清单",
      "headline": [
        {
          "t": "投递前先做这"
        },
        {
          "t": "三件事",
          "style": "red"
        },
        {
          "t": "："
        },
        {
          "br": true
        },
        {
          "t": "从一段投放证据开始。"
        }
      ],
      "page_label": "行动路线",
      "takeaway": "**改句子不会让匹配分上涨**，分数只认写进简历的真实事实；空白也一样——补事实才补分，补形容词没有用。"
    },
    "evidence_card": {
      "kicker": "判定与门槛 · 证据详情",
      "headline": [
        {
          "t": "两实据、一半边、"
        },
        {
          "br": true
        },
        {
          "t": "一个"
        },
        {
          "t": "看不出来",
          "style": "marker"
        },
        {
          "t": "。"
        }
      ],
      "page_label": "判定与门槛"
    }
  },
  "social": {
    "titles": [
      {
        "text": "活动策划简历自查：你的参与率数字，是不是也缩在句尾？",
        "basis": {
          "finding": 1,
          "rewrite": 1
        }
      },
      {
        "text": "「熟悉投放渠道」整条空白怎么办？先补一段实操再投",
        "basis": {
          "finding": 2,
          "action": 1
        }
      },
      {
        "text": "组织过校园活动 ≠ 有校园渠道：这半步差在哪",
        "basis": {
          "finding": 3
        }
      }
    ],
    "body_md": "一位应届生的市场岗简历自查（合成案例），三个发现，你可以对照自己的简历查一遍：\n\n1. 岗位要「策划面向年轻用户群体的线上活动，负责执行与复盘」。执行那半边有实据：社群抽奖参与率约 25%、校园活动 300+ 人参与——但一个数字在括号里、一个在句尾。「复盘」两个字，简历里没写过。\n2. 「熟悉主流线上投放渠道（信息流/搜索/社媒）」整条空白。空白不等于不会——但它实实在在拉低证据覆盖，补一段实操（哪怕个人账号小额投流）就能改写这条判定。\n3. 「有校园渠道或 KOC 资源者优先」：组织过活动不等于有可复用的渠道关系，相关但不对等，记一半。真有社团合作或 KOC 联系方式，写进去就是加分项。\n\n方法就一条：把活动数字放到每条经历的第一句，把没写的版块老老实实补上——改句子不会让匹配分上涨，分数只认写进简历的事实。",
    "synthetic_note": "（分数 = 简历证据对 JD 的覆盖度，不代表能力或录取概率；案例已匿名，素材为合成案例。）"
  }
}
